{
  "$schema": "https://json-schema.org/draft/2020-12/schema",
  "$id": "https://cdx.dev/schemas/provenance.schema.json",
  "title": "CDX Provenance Record",
  "description": "Schema for provenance/record.json in a CDX document",
  "type": "object",
  "required": ["version", "documentId", "created"],
  "properties": {
    "version": {
      "type": "string",
      "description": "Provenance schema version",
      "pattern": "^\\d+\\.\\d+$"
    },
    "documentId": {
      "description": "Document identifier (hash)",
      "$ref": "https://cdx.dev/schemas/anchor.schema.json#/$defs/contentHash"
    },
    "created": {
      "type": "string",
      "format": "date-time",
      "description": "Document creation timestamp"
    },
    "creator": {
      "$ref": "#/$defs/actor",
      "description": "Document creator"
    },
    "lineage": {
      "type": "object",
      "description": "Document lineage information",
      "properties": {
        "parent": {
          "description": "Parent document hash",
          "anyOf": [
            { "$ref": "https://cdx.dev/schemas/anchor.schema.json#/$defs/contentHash" },
            { "type": "null" }
          ]
        },
        "ancestors": {
          "type": "array",
          "description": "Chain of ancestor hashes (nearest first; advisory cross-check, authoritative only where resolved — see 09 §3.3)",
          "items": { "$ref": "https://cdx.dev/schemas/anchor.schema.json#/$defs/contentHash" },
          "maxItems": 1024
        },
        "depth": {
          "type": "integer",
          "minimum": 1,
          "description": "Generation number: 1 for the root document, incremented by 1 each generation (one more than the number of ancestor links). Advisory; recomputed on verification."
        },
        "branch": {
          "type": "string",
          "description": "Branch identifier"
        },
        "mergedFrom": {
          "type": "array",
          "description": "Merged document hashes (each resolved like a parent — see 09 §3.4)",
          "items": { "$ref": "https://cdx.dev/schemas/anchor.schema.json#/$defs/contentHash" },
          "maxItems": 1024
        }
      },
      "additionalProperties": false
    },
    "merkle": {
      "type": "object",
      "description": "Merkle tree information",
      "properties": {
        "root": {
          "description": "Merkle root hash",
          "$ref": "https://cdx.dev/schemas/anchor.schema.json#/$defs/contentHash"
        },
        "blockCount": {
          "type": "integer",
          "minimum": 0,
          "description": "Number of content blocks"
        },
        "algorithm": {
          "type": "string",
          "description": "Hash algorithm used",
          "enum": ["sha256", "sha384", "sha512", "sha3-256", "sha3-512", "blake3"]
        }
      },
      "additionalProperties": false
    },
    "timestamps": {
      "type": "array",
      "description": "Timestamp anchors",
      "items": {
        "$ref": "#/$defs/timestamp"
      },
      "maxItems": 256
    },
    "derivedFrom": {
      "type": "array",
      "description": "Source documents this was derived from",
      "items": {
        "$ref": "#/$defs/derivation"
      },
      "maxItems": 1024
    }
  },
  "additionalProperties": false,
  "$defs": {
    "actor": {
      "type": "object",
      "properties": {
        "name": {
          "type": "string",
          "description": "Actor name"
        },
        "identifier": {
          "type": "string",
          "description": "Actor identifier (DID, email, etc.)"
        },
        "organization": {
          "type": "string",
          "description": "Organization name"
        }
      },
      "additionalProperties": false
    },
    "timestamp": {
      "description": "A trusted-timestamp anchor proving the document hash existed at or before a point in time (core 09 §6). Discriminated by `type` into three closed branches, each carrying exactly the fields its verification procedure requires. The timestamped hash MUST equal the record's `documentId` (and, on a frozen/published document, the signature-authenticated `manifest.id`) — see 09 §6.2; `time` is advisory only, the authoritative time comes from the validated proof (09 §6.6).",
      "oneOf": [
        {
          "description": "RFC 3161 trusted-timestamp token. The token's messageImprint binds `hash`; a verifier validates the token's TSA certificate chain to a configured TSA trust store and confirms the imprint equals `hash` (09 §6.3).",
          "type": "object",
          "required": ["type", "time", "hash", "token"],
          "properties": {
            "type": { "const": "rfc3161", "description": "RFC 3161 TSA timestamp." },
            "time": { "type": "string", "format": "date-time", "description": "Advisory claimed time (display only); the authoritative time is the validated token's genTime." },
            "hash": {
              "description": "The timestamped hash; MUST equal the record's documentId.",
              "$ref": "https://cdx.dev/schemas/anchor.schema.json#/$defs/contentHash"
            },
            "token": {
              "description": "RFC 3161 TimeStampToken (a CMS SignedData), DER base64.",
              "$ref": "https://cdx.dev/schemas/anchor.schema.json#/$defs/base64"
            },
            "authority": { "type": "string", "description": "Advisory TSA URL (display only); the TSA is authenticated by its certificate chain, not this field." }
          },
          "additionalProperties": false
        },
        {
          "description": "Direct blockchain anchor: a transaction on `chain` in block `blockHash` commits `hash`. A verifier locates the transaction by `blockHash` (not height) on the canonical chain at the required confirmation/finality depth (09 §6.4).",
          "type": "object",
          "required": ["type", "time", "hash", "chain", "blockHeight", "blockHash", "txId"],
          "properties": {
            "type": { "const": "blockchain", "description": "Direct on-chain anchor." },
            "time": { "type": "string", "format": "date-time", "description": "Advisory claimed time (display only); the authoritative bound is the block's confirmation under chain-specific slack." },
            "hash": {
              "description": "The timestamped hash; MUST equal the record's documentId.",
              "$ref": "https://cdx.dev/schemas/anchor.schema.json#/$defs/contentHash"
            },
            "chain": { "type": "string", "enum": ["bitcoin", "ethereum"], "description": "Anchoring chain." },
            "blockHeight": { "type": "integer", "minimum": 0, "description": "Block height (advisory locator; blockHash is authoritative under reorgs)." },
            "blockHash": { "type": "string", "description": "Block hash — the reorg-resistant locator a verifier confirms is on the canonical chain." },
            "txId": { "type": "string", "description": "Anchoring transaction id." },
            "merkleProof": {
              "type": "array",
              "description": "Optional SPV proof of txId's inclusion in the block (a full node does not need it).",
              "items": { "type": "string" },
              "maxItems": 256
            }
          },
          "additionalProperties": false
        },
        {
          "description": "Aggregated anchor (e.g. OpenTimestamps): many document hashes are batched into one `merkleRoot` committed on-chain by `anchor`. The Merkle leaf is `proof.documentHash` (which MUST equal the record's documentId and `hash`), tied to `merkleRoot` by `proof.path`. `provider`/`calendar` are advisory delivery hints, never trusted — the proof self-verifies against the on-chain anchor (09 §6.5).",
          "type": "object",
          "required": ["type", "time", "hash", "proof", "merkleRoot", "anchor"],
          "properties": {
            "type": { "const": "aggregated", "description": "Aggregated (Merkle-batched) anchor." },
            "time": { "type": "string", "format": "date-time", "description": "Advisory claimed time (display only); the authoritative bound is the anchor block's confirmation." },
            "hash": {
              "description": "The timestamped hash; MUST equal both the record's documentId and proof.documentHash.",
              "$ref": "https://cdx.dev/schemas/anchor.schema.json#/$defs/contentHash"
            },
            "proof": {
              "type": "object",
              "description": "Inclusion proof of documentHash in the aggregate Merkle tree.",
              "required": ["documentHash", "path"],
              "properties": {
                "documentHash": {
                  "description": "The Merkle leaf — the aggregated document hash; MUST equal the record's documentId.",
                  "$ref": "https://cdx.dev/schemas/anchor.schema.json#/$defs/contentHash"
                },
                "path": {
                  "type": "array",
                  "description": "Sibling chain from documentHash up to merkleRoot (bounded to match the reference verifier's MAX_MERKLE_PATH).",
                  "items": { "$ref": "#/$defs/merklePathElement" },
                  "maxItems": 256
                }
              },
              "additionalProperties": false
            },
            "merkleRoot": {
              "description": "The aggregate Merkle root committed on-chain by anchor.",
              "$ref": "https://cdx.dev/schemas/anchor.schema.json#/$defs/contentHash"
            },
            "provider": { "type": "string", "description": "Advisory aggregation provider (display only)." },
            "calendar": { "type": "string", "description": "Advisory calendar URL that delivers the proof; untrusted — the proof self-verifies against the on-chain anchor (display only)." },
            "anchor": {
              "type": "object",
              "description": "On-chain commitment of merkleRoot.",
              "required": ["chain", "blockHash", "txId"],
              "properties": {
                "chain": { "type": "string", "enum": ["bitcoin", "ethereum"], "description": "Anchoring chain." },
                "blockHeight": { "type": "integer", "minimum": 0, "description": "Anchor block height (advisory locator)." },
                "blockHash": { "type": "string", "description": "Anchor block hash (reorg-resistant locator)." },
                "txId": { "type": "string", "description": "Anchoring transaction id." }
              },
              "additionalProperties": false
            }
          },
          "additionalProperties": false
        }
      ]
    },
    "derivation": {
      "type": "object",
      "required": ["documentId", "relationship"],
      "properties": {
        "documentId": {
          "description": "Source document hash",
          "$ref": "https://cdx.dev/schemas/anchor.schema.json#/$defs/contentHash"
        },
        "relationship": {
          "type": "string",
          "description": "Relationship type",
          "enum": ["excerpt", "translation", "revision", "derivation", "quotation"]
        },
        "blocks": {
          "type": "array",
          "description": "Specific blocks derived from source",
          "items": { "type": "string" }
        }
      },
      "additionalProperties": false
    },
    "merklePathElement": {
      "type": "object",
      "required": ["position", "hash"],
      "properties": {
        "position": {
          "type": "string",
          "enum": ["left", "right"],
          "description": "Position of sibling in hash computation"
        },
        "hash": {
          "description": "Sibling hash",
          "$ref": "https://cdx.dev/schemas/anchor.schema.json#/$defs/contentHash"
        }
      },
      "additionalProperties": false
    }
  }
}
